{
  "$schema": "https://json-schema.org/draft/2020-12/schema",
  "$id": "smartpc-theme-pack-v1",
  "type": "object",
  "required": [
    "schemaVersion",
    "id",
    "name",
    "version"
  ],
  "properties": {
    "schemaVersion": {
      "const": 1
    },
    "id": {
      "type": "string",
      "pattern": "^[a-z][a-z0-9_.-]{0,63}$"
    },
    "name": {
      "type": "string",
      "maxLength": 80,
      "minLength": 1
    },
    "version": {
      "type": "string",
      "pattern": "^\\d+\\.\\d+\\.\\d+$"
    },
    "extends": {
      "type": "string",
      "pattern": "^[a-z][a-z0-9_.-]{0,63}$"
    },
    "tokens": {
      "type": "object",
      "properties": {
        "colors.background": {
          "type": "string",
          "default": "#101923",
          "pattern": "^#[0-9a-fA-F]{6}$"
        },
        "colors.backgroundOverlay": {
          "type": "string",
          "default": "#0b1219",
          "pattern": "^#[0-9a-fA-F]{6}$"
        },
        "colors.surface": {
          "type": "string",
          "default": "#1c2d38",
          "pattern": "^#[0-9a-fA-F]{6}$"
        },
        "colors.surfaceFocused": {
          "type": "string",
          "default": "#28403f",
          "pattern": "^#[0-9a-fA-F]{6}$"
        },
        "colors.border": {
          "type": "string",
          "default": "#35525d",
          "pattern": "^#[0-9a-fA-F]{6}$"
        },
        "colors.divider": {
          "type": "string",
          "default": "#31505b",
          "pattern": "^#[0-9a-fA-F]{6}$"
        },
        "colors.textPrimary": {
          "type": "string",
          "default": "#e9f1ef",
          "pattern": "^#[0-9a-fA-F]{6}$"
        },
        "colors.textSecondary": {
          "type": "string",
          "default": "#b3c2c7",
          "pattern": "^#[0-9a-fA-F]{6}$"
        },
        "colors.accent": {
          "type": "string",
          "default": "#6de0be",
          "pattern": "^#[0-9a-fA-F]{6}$"
        },
        "colors.bannerSurface": {
          "type": "string",
          "default": "#29423f",
          "pattern": "^#[0-9a-fA-F]{6}$"
        },
        "colors.debugSurface": {
          "type": "string",
          "default": "#273e48",
          "pattern": "^#[0-9a-fA-F]{6}$"
        },
        "colors.demoSurface": {
          "type": "string",
          "default": "#304750",
          "pattern": "^#[0-9a-fA-F]{6}$"
        },
        "shape.radiusCard": {
          "type": "integer",
          "default": 13,
          "minimum": 0,
          "maximum": 24
        },
        "shape.radiusRow": {
          "type": "integer",
          "default": 9,
          "minimum": 0,
          "maximum": 24
        },
        "shape.radiusPill": {
          "type": "integer",
          "default": 7,
          "minimum": 0,
          "maximum": 24
        },
        "shape.radiusButton": {
          "type": "integer",
          "default": 6,
          "minimum": 0,
          "maximum": 24
        },
        "metrics.spacing": {
          "type": "integer",
          "default": 24,
          "minimum": 8,
          "maximum": 40
        },
        "metrics.listRows": {
          "type": "integer",
          "default": 4,
          "minimum": 3,
          "maximum": 4
        },
        "metrics.borderWidth": {
          "type": "integer",
          "default": 2,
          "minimum": 1,
          "maximum": 4
        },
        "metrics.focusWidth": {
          "type": "integer",
          "default": 3,
          "minimum": 2,
          "maximum": 4
        },
        "typography.textScale": {
          "type": "number",
          "default": 1.0,
          "minimum": 0.85,
          "maximum": 1.1
        },
        "typography.uiFamily": {
          "type": "string",
          "default": "",
          "maxLength": 120
        },
        "typography.numbersFamily": {
          "type": "string",
          "default": "",
          "maxLength": 120
        },
        "typography.displayFamily": {
          "type": "string",
          "default": "",
          "maxLength": 120
        },
        "typography.bodyWeight": {
          "type": "integer",
          "default": 400,
          "minimum": 100,
          "maximum": 900
        },
        "typography.headingWeight": {
          "type": "integer",
          "default": 700,
          "minimum": 100,
          "maximum": 900
        },
        "typography.size18": {
          "type": "integer",
          "default": 18,
          "minimum": 13,
          "maximum": 22
        },
        "typography.size19": {
          "type": "integer",
          "default": 19,
          "minimum": 14,
          "maximum": 23
        },
        "typography.size20": {
          "type": "integer",
          "default": 20,
          "minimum": 15,
          "maximum": 25
        },
        "typography.size21": {
          "type": "integer",
          "default": 21,
          "minimum": 15,
          "maximum": 26
        },
        "typography.size22": {
          "type": "integer",
          "default": 22,
          "minimum": 16,
          "maximum": 27
        },
        "typography.size23": {
          "type": "integer",
          "default": 23,
          "minimum": 17,
          "maximum": 28
        },
        "typography.size24": {
          "type": "integer",
          "default": 24,
          "minimum": 18,
          "maximum": 30
        },
        "typography.size25": {
          "type": "integer",
          "default": 25,
          "minimum": 18,
          "maximum": 31
        },
        "typography.size26": {
          "type": "integer",
          "default": 26,
          "minimum": 19,
          "maximum": 32
        },
        "typography.size27": {
          "type": "integer",
          "default": 27,
          "minimum": 20,
          "maximum": 33
        },
        "typography.size28": {
          "type": "integer",
          "default": 28,
          "minimum": 21,
          "maximum": 35
        },
        "typography.size29": {
          "type": "integer",
          "default": 29,
          "minimum": 21,
          "maximum": 36
        },
        "typography.size30": {
          "type": "integer",
          "default": 30,
          "minimum": 22,
          "maximum": 37
        },
        "typography.size31": {
          "type": "integer",
          "default": 31,
          "minimum": 23,
          "maximum": 38
        },
        "typography.size32": {
          "type": "integer",
          "default": 32,
          "minimum": 24,
          "maximum": 40
        },
        "typography.size33": {
          "type": "integer",
          "default": 33,
          "minimum": 24,
          "maximum": 41
        },
        "typography.size34": {
          "type": "integer",
          "default": 34,
          "minimum": 25,
          "maximum": 42
        },
        "typography.size35": {
          "type": "integer",
          "default": 35,
          "minimum": 26,
          "maximum": 43
        },
        "typography.size36": {
          "type": "integer",
          "default": 36,
          "minimum": 27,
          "maximum": 45
        },
        "typography.size37": {
          "type": "integer",
          "default": 37,
          "minimum": 27,
          "maximum": 46
        },
        "typography.size39": {
          "type": "integer",
          "default": 39,
          "minimum": 29,
          "maximum": 48
        },
        "typography.size40": {
          "type": "integer",
          "default": 40,
          "minimum": 30,
          "maximum": 50
        },
        "typography.size45": {
          "type": "integer",
          "default": 45,
          "minimum": 33,
          "maximum": 56
        },
        "typography.size46": {
          "type": "integer",
          "default": 46,
          "minimum": 34,
          "maximum": 57
        },
        "typography.size47": {
          "type": "integer",
          "default": 47,
          "minimum": 35,
          "maximum": 58
        },
        "typography.size52": {
          "type": "integer",
          "default": 52,
          "minimum": 39,
          "maximum": 65
        },
        "typography.size56": {
          "type": "integer",
          "default": 56,
          "minimum": 42,
          "maximum": 70
        },
        "typography.size65": {
          "type": "integer",
          "default": 65,
          "minimum": 48,
          "maximum": 81
        },
        "typography.size69": {
          "type": "integer",
          "default": 69,
          "minimum": 51,
          "maximum": 86
        },
        "typography.size139": {
          "type": "integer",
          "default": 139,
          "minimum": 104,
          "maximum": 173
        },
        "typography.size152": {
          "type": "integer",
          "default": 152,
          "minimum": 114,
          "maximum": 190
        },
        "typography.size44": {
          "type": "integer",
          "default": 44,
          "minimum": 33,
          "maximum": 55
        },
        "metrics.compactRows": {
          "type": "integer",
          "default": 3,
          "minimum": 2,
          "maximum": 3
        },
        "metrics.overviewRows": {
          "type": "integer",
          "default": 3,
          "minimum": 2,
          "maximum": 3
        },
        "metrics.fantasyRows": {
          "type": "integer",
          "default": 5,
          "minimum": 4,
          "maximum": 5
        },
        "typography.clockWeight": {
          "type": "integer",
          "default": 300,
          "minimum": 100,
          "maximum": 900
        },
        "shape.radiusPanel": {
          "type": "integer",
          "default": 10,
          "minimum": 0,
          "maximum": 24
        },
        "shape.radiusBadge": {
          "type": "integer",
          "default": 8,
          "minimum": 0,
          "maximum": 24
        },
        "shape.radiusDense": {
          "type": "integer",
          "default": 5,
          "minimum": 0,
          "maximum": 16
        },
        "shape.radiusMarker": {
          "type": "integer",
          "default": 2,
          "minimum": 0,
          "maximum": 6
        },
        "metrics.hairlineWidth": {
          "type": "integer",
          "default": 1,
          "minimum": 0,
          "maximum": 2
        },
        "ext.summary.clockInset": {
          "type": "integer",
          "default": 24,
          "minimum": 0,
          "maximum": 80
        }
      },
      "additionalProperties": false
    },
    "palettes": {
      "type": "object",
      "properties": {
        "day": {
          "$ref": "#/properties/tokens"
        },
        "night": {
          "$ref": "#/properties/tokens"
        }
      },
      "additionalProperties": false
    },
    "presentations": {
      "type": "object",
      "additionalProperties": {
        "type": "string",
        "pattern": "^[a-z][a-z0-9_.-]{0,63}$"
      }
    },
    "motion": {
      "type": "object",
      "additionalProperties": {
        "type": "object",
        "required": [
          "recipe",
          "durationMs",
          "distancePx",
          "easing"
        ],
        "properties": {
          "recipe": {
            "type": "string"
          },
          "durationMs": {
            "type": "number",
            "minimum": 0,
            "maximum": 600
          },
          "distancePx": {
            "type": "number",
            "minimum": 0,
            "maximum": 80
          },
          "easing": {
            "enum": [
              "linear",
              "outCubic",
              "outQuad",
              "inOutQuad"
            ]
          }
        }
      }
    },
    "scene": {
      "type": "object",
      "properties": {
        "enabled": {
          "type": "boolean"
        },
        "renderer": {
          "type": "string"
        }
      }
    },
    "iconSetId": {
      "type": "string"
    },
    "iconApiVersion": {
      "const": 1
    },
    "iconOverrides": {
      "type": "object"
    },
    "assets": {
      "type": "array",
      "maxItems": 64,
      "items": {
        "type": "object",
        "required": [
          "id",
          "type",
          "path"
        ],
        "properties": {
          "id": {
            "type": "string",
            "pattern": "^[a-z][a-z0-9_.-]{0,63}$"
          },
          "type": {
            "enum": [
              "font",
              "image",
              "data"
            ]
          },
          "path": {
            "type": "string",
            "minLength": 1
          },
          "sha256": {
            "type": "string",
            "pattern": "^[0-9a-f]{64}$"
          }
        }
      }
    },
    "requirements": {
      "type": "array",
      "items": {
        "enum": [
          "presentation1",
          "motion1",
          "icons1",
          "scene1"
        ]
      }
    }
  },
  "additionalProperties": false
}
