{
  "schemaVersion":1,"id":"personal.sample","name":"Esempio personale","version":"1.0.0","extends":"base",
  "tokens":{"shape.radiusCard":0,"colors.accent":"#b5d3ff","ext.summary.clockInset":24},
  "presentations":{"home.now":"example.home.summary"},
  "motion":{"navigate.family":{"recipe":"builtin.fade","durationMs":120,"distancePx":0,"easing":"outCubic"}}
}
